authors,title,journal,volume,issue,year,pages,link,pdfLink"Shuanglin Chen, Weisheng Cao, Chuan Zhang, Jun Zhu, Fan Zhang, Qian Li, Jieyu Zhang",Calculation of property contour diagrams,CALPHAD,55,Part 1,2016,63-68,http://www.sciencedirect.com/science/article/pii/S0364591616300712,"S. Chen, W. Cao, F. Zhang, Q. Li, J. Zhang, C. Zhang, and J. Zhu",Calculation of 2D and 3D Phase Diagram,JOM,67,8,2015,1876-1880,https://www.researchgate.net/publication/283020875_Calculation_of_2D_and_3D_Phase_Diagrams,"J. Zhu, C. Zhang, W. Cao, S. Chen, F. Zhang, J. S. Park, and S. Yi",Molar Volume Modeling of Ti-Al-Nb and Ti-Al-Mo Ternary Systems,JOM,67,8,2015,1881-1885,http://link.springer.com/article/10.1007%2Fs11837-015-1493-6,"F. Zhang, C. Zhang, S.L. Chen, J. Zhu, W.S. Cao, and U.R. Kattner",An understanding of high entropy alloys from phase diagram calculations,CALPHAD,45,8,2014,1-10,http://www.sciencedirect.com/science/article/pii/S0364591613001028,"Shuang-Lin Chen, Ying Yang, Sinn-Wen Chen, Xiong-Gang Lu, and Y. Austin Chang",Solidification Simulation Using Scheil Model in Multicomponent Systems,J. Phase Equilib. Diffus.,30,,2009,429,http://link.springer.com/article/10.1007/s11669-009-9568-0,/assets/papers/solidification.pdf"Shuang-Lin Chen, Jie-Yu Zhang, Xiong-Gang Lu, Kuo-Chih Chou, and Y. Austin Chang",Application of Graham Scan Algorithm in Binary Phase Diagram Calculation,Journal of Phase Equilibria and Diffusion,27,2,2006,1-5,,"Wang, LJ, Chen, SL, Chou, KC, Chang, YA",Calculation of density in a ternary system with a limited homogenous region using a geometric model,CALPHAD,29,2,2005,149-154,,"Cao, W, Zhu, J, Yang, Y, Zhang, F, Chen, S, Oates, WA, Chang, YA",Application of the cluster/site approximation to fcc phases in Ni-Al-Cr system,Acta Mater,53,15,2005,4189-4197,,"Wang, Y., Ma, N, Chen, Q, Zhang, F, Chen, SL, Chang, YA","Predicting phase equilibrium, phase transformation, and microstructure evolution in titanium alloys",JOM,57,9,2005,32-39,,"Wang, LJ, Chou, KC, Chen, SL, Chang, YA",Estimating ternary surface tension for systems with limited solubility,ZEITSCHRIFT FUR METALLKUNDE,96,8,2005,948-950,,"Zhang, F, Xie, FY, Chen, SL, Chang, YA, Furrer, D, Venkatesh, V,",Predictions of titanium alloy properties using thermodynamic modeling tools,JOURNAL OF MATERIALS ENGINEERING AND PERFORMANCE,14,6,2005,717-721,,"Du, Y,Chang, YA, Liu, SH,Huang, BY,Xie, FY, Yang, Y, Chen, SL",Thermodynamic description of the Al-Fe-Mg-Mn-Si system and investigation of microstructure and microsegregation during directional solidification of an Al-Fe-Mg-Mn-Si alloy,ZEITSCHRIFT FUR METALLKUNDE,96,12,2005,1351-1362,,"W. Cao, Y. A. Chang, J. Zhu, S.-L. Chen, W. A. Oates",Application of the Cluster/Site Approximation to the Calculation of Multicomponent Alloy Phase Diagrams,Acta Mater,53,,2005,331-335,,"Y. A. Chang, X.-Y. Yan, F.-Y. Xie, S.-L. Chen",Phase formation and solidification path analysis of multicomponent aluminum alloys,Solidification of Aluminium Alloys Symposium,,,2004,3-18,,"Y. A. Chang, S.-L. Chen, F. Zhang, X.-Y. Yan, F.-Y. Xie, R. Schmid-Fetzer and W. A. Oates","Phase Diagram Calculation: Past, Present and Future",Progress in Materials Science,49,,2004,313-345,,S.-W. Chen and S.-L. Chen,Phase Diagram and Its Calculation with an Example of Lead-free Solder,Materials Science Bulletin (in Chinese),10,1,2003,34-42,,"X. J. Liu, S.-L. Chen, I. Ohnuma, K. Ishida, Y. A. Chang",Design of micro-soldering materials in electronic packaging using computational thermodynamics,Mechanics and Material Engineering for Science and Experiments,,,2003,334-337,,"S.-L. Chen, F. Zhang, S. Daniel, F.-Y. Xie, X.-Y. Yan, Y. A. Chang, R. Schmid-Fetzer and W. A. Oates",Calculating phase diagrams using PANDAT and PanEngine,JOM,55,12,2003,48-51,,"Y. Du, Y. A. Chang, Z.-J. Jin, B.-Y. Huang, F. Zhang and S.-L. Chen",Thermodynamic Properties of the Al-Nb-Ni System,Intermetallics,11,,2003,995-1013,,"F.-Y. Xie, X-Y Yan, L. Ding, F. Zhang, S.-L. Chen, M. G. Chu, and Y. A. Chang",A Study of Microstructure and Microsegregation on Aluminum 7050 Alloy,Mater. Sci. Engin.,A355,,2003,144-153,,"F. Zhang, Y. A. Chang, Y. Du, S.-L. Chen and W. A. Oates",Application of the Cluster-Site Approximation (CSA) Model to the FCC Phase in the Ni-Al System,Acta Mater,51,,2003,207-216,,"Y. A. Chang, S.-L. Chen, F. Zhang and W. A. Oates",Improving Multicomponent Phase Diagram Calculations,"CALPHAD and Alloy Thermodynamics (Eds.: P. E. A. Turch, A. Gonis and R. D. Shull) TMS, Warrendale, PA",,,2002,53-60,,"X.-Y. Yan, S.-L. Chen, F.-Y. Xie, and Y. A. Chang",Computational and Experimental Investigation of Microsegregation in an Al-rich Al-Cu-Mg-Si Quaternary Alloy,Acta Mater.,50,,2002,2199-2207,,"S.-L. Chen, S. Daniel, F. Zhang, Y. A. Chang, X.-Y. Yan, F.-Y. Xie, R. Schmid-Fetzer and W. A. Oates",The PANDATA Software Package and Its Applications,CALPHAD,26,2,2002,175-188,,"F. Zhang, S.-L. Chen, Y. A. Chang and W. A. Oates",An improved approach for obtaining thermodynamic descriptions of intermetallic phases: Application to the Cr-Ta system,Intermetallics,9,,2001,1079-1083,,"Y. A. Chang, X.-Y. Yan, S. Daniel, F.Y. Xie; S.-L. Chen and F. Zhang",PANDAT and PanEngine-their applications in multicomponent phase diagram calculation and microstructure prediction,"Materials Design Approaches and Experiences. Proceedings of Symposium, TMS",,,2001,85-96,,"X.-Y. Yan, Y. A. Chang, Y. Yang, F.-Y. Xie, S.-L. Chen, F. Zhang, S. Daniel, M.-H. He",A Thermodynamic Approach for Predicting the Tendency of Multicomponent Metallic Alloys for Glass Formation,Intermetallics,9,6,2001,535-538,,"S.-L. Chen, S. Daniel, F. Zhang, Y. A. Chang, W. A. Oates and R. Schmid-Fetzer",On the Calculation of Multicomponent Stable Phase Diagrams,J. Phase Equilibria,22,4,2001,373-378,,"X.-Y. Yan, Y. A. Chang, F.-Y. Xie, S.-L. Chen, F. Zhang, and S. Daniel",Calculated Phase Diagrams of Aluminum Alloys from Binary Al-Cu to Multicomponent Commercial Alloy,J. Alloy Compounds,230,,2001,151-160,,"X.Y. Yan, L. Ding, S.-L. Chen, F.-Y. Xie, M. Chu and Y. A. Chang",Predicting Microstructure and Microsegregation in Multicomponent Aluminum Alloys,"in Light Metals 2001, (Editor: J. L. Anjier) TMS, Warrendale, PA",,,2001,1091-1097,,"J. Zhang, W. A. Oates, F. Zhang, S.-L. Chen, K.-C. Chou and Y, A. Chang",Cluster/Site Approximation of the Ordering Phase Diagram for Cd-Mg Alloys,Intermetallics,9,,2001,5-8,,"W. A. Oates, F. Zhang, S.-L. Chen and Y. A. Chang",Some Problems Arising from two Sublattice Modeling of Ordered Phases,CALPHAD,23,,1999,181-188,,"W. A. Oates, F. Zhang, S.-L. Chen and Y. A. Chang",An Improved Cluster/Site Approximation for the Entropy of Mixing in Multicomponent Solid Solutions,Phys. Rev. B,59,,1999,11221-11225,,"T. Kraft, S.-L. Chen and Y. A. Chang",Prediction of Microsegregation in Castings using Calculated Phase diagrams,"in Proceedings of the Fifth Asian Foundry Congress, (Eds.: G. Sun, H.-Y Yuan, R.-B. Yao and X.-Y. Yan) Southeast University Press, Nanjing, P. R. China",,,1997,1,,"Y. A. Chang, F.-Y. Shiau, S.-L. Chen and S. Mohney",Thermodynamic Considerations in the Rationalization of Solid-State Amorphization Between Metals and III_V Semiconductors,"in Thermodynamics of Alloy Formation (Eds: Y. A. Chang and F. Sommer), TMS, Warrendale, PA",,,1997,187-198,,Y. A. Chang and S.-L. Chen,Thermodynamics of Metallic Solutions,"in Advanced Physical Chemistry in Process Metallurgy (Eds.: N. Sano, W-K Lu and P. V. Riboud), Academic Press Ltd., London, U. K.",,,1997,5-43,,"F. Zhang, S. L. Chen, Y. A. Chang and U. R. Kattner",A Thermodynamic Description of the Ti-Al System,Intermetallics,5,,1997,471-482,,"H. Liang, S.-L. Chen and Y. A. Chang",A Thermodynamic Description of the Al-Mg-Zn System,Metall. Mater. Trans.,28A,,1997,1725,,"S.-L. Chen, Y. Zuo, H. Liang and Y. A. Chang",A Thermodynamic Description of Al-Mg-Cu,Metall. Mater. Trans.,28A,,1997,435-446,,"F. Zhang, S.-L. Chen and Y. A. Chang",A Thermodynamic Description of the Ti-Al-V System,"in Proceedings of the International Conference on Modeling and simulation in Metallurgical Engineering and Materials Science, (Editors: Zongsen Yu, Zeqiang Xiao and Xishan Xie), Metallurgical Industry Press, Beijing, PRC",,,1996,191,,"Y. A. Chang, S.-L. Chen, Y. Zuo, F. Zhang, S. L. Daniel, C.-H. Moon, H. Liang, F.-Y. Xie, W. Huang, Z.K. Liu and K.C. Chou",Phase Diagram Calculation: A Critical Tool For Alloy and Processing Design,"in Proceedings of the International Conference on Modeling and simulation in Metallurgical Engineering and Materials Science, (Editors: Zongsen Yu, Zeqiang Xiao and Xishan Xie), Metallurgical Industry Press, Beijing, PRC",,,1996,185,,"L. M. Pike, C. R. Kao, S.-L. Chen and Y. A. Chang",On the Site Preferences of Ternary Additions to Triple Defect B2 Intermetallic Compounds,"in Design Fundamentals of High Temperature Composites, Intermetallics and Metal-Ceramic Systems (Ed: R. Y. Lin, Y. A. Chang, R. G. Reddy and C. T. Liu) The Mineral, Metals and Materials Society, Warrendale, PA",,,1996,171-185,,"F. Zhang, S.-L. Chen, Y. A. Chang and U. R. Kattner",Thermodynamic Stability and Point Defects of *-TiAl and the Phase Relationships of Ti-Al,"in Gamma Titanium Aluminides (Eds.: Y.-W. Kim, R. Wagner and M. Yamaguchi) The Mineral, Metals and Materials Society, Warrendale, PA",,,1995,131-140,,S.-L. Chen and Y. A. Chang,On the Calculation of Multi-Component Stability Diagrams,"in Applications of Thermodynamics in the Synthesis and Processing of Materials (Eds.: P. Nash and B. Sundman) The Minerals, Metals and Materials Society, Warrendale, PA",,,1995,37,,"A. Bolcavage, C. R. Kao, S.-L. Chen and Y. A. Chang",Thermodynamic Calculation of Phase Stability Between Copper and Lead-Indium Solder,"in Applications of Thermodynamics in the Synthesis and Processing of Materials (Eds.: P. Nash and B. Sundman) The Minerals, Metals and Materials Society, Warrendale, PA",,,1995,171,,"Shuang-Lin Chen, C. R. Kao and Y. A. Chang","A Generalized Quasi-Chemical Model For Ordered Multi-Component, Multi-Sublattice Intermetallic Compounds With Anti-Structure Defects",Intermetallics,3,,1995,233,,"C. R. Kao, L. M. Pike, S.-L. Chen and Y. A. Chang",Site Preference of Substitutional Additions in Triple-Defect B2 Intermetallic Compounds,Intermetallics,2,,1994,235-247,,"Shuang-Lin Chen, W. Oldfield, Y. A. Chang and M. K. Thomas",Modelling Solidification of Turbine Blades Using Theoretical Phase Relationships,Metall. Mater. Trans.,25A,7,1994,1525-1533,,Shuang-Lin Chen and Y. A. Chang,The Shapes of the Phase Boundaries of Two Ideal Solution Phases in Ternary and Higher Order Systems,Metall. Mater. Trans.,25A,3,1994,656-658,,"C. R. Kao, A. Bolcavage, Shuang-Lin Chen, Y. A. Chang and A. D. Romig, Jr.","Phase Equilibria of the Cu-In System, II: Thermodynamic Assessment and Calculation of Phase Diagram",J. Phase Equilibria,14,1,1993,22-30,,"Shuang-Lin Chen, Kuo-Chih Chou and Y. A. Chang","On a New Strategy for Phase Diagram Calculation, 1. Basic Principles",CALPHAD,17,3,1993,237-250,,"Shuang-Lin Chen, Kuo-Chih Chou and Y. A. Chang","On a New Strategy for Phase Diagram Calculation, 2. Binary Systems",CALPHAD,17,3,1993,287-302,,Shuang-Lin Chen and Y. A. Chang,A Thermodynamic Analysis of the Al-Zn System and Phase Diagram Calculation,CALPHAD,17,2,1993,113-124,,"Shuang-Lin Chen, Y. Zuo, C. R. Kao and Y. A. Chang",On the Optimization of Solution Model Parameter Values of Phases and the Calculation of Phase Diagrams,CALPHAD,17,1,1993,47-56,,"Fan Zhang, Shuang-Lin Chen and Kuo-Chih Chou",A New Treatment for Calculating Activities from Phase Diagrams Involving Intermediate Compounds,CALPHAD,16,3,1992,269-276,,"F.-Y. Shiau, Shuang-Lin Chen, M. Loomans and Y. A. Chang",Thermodynamic Analysis for the Solid-State Amorphization and Subsequent Crystallization of GaAs/Co,"in Phase Transformation Kinetics in Thin Films, M. Chen, M. O. Thompson, R. B. Schwarz and M. Libera, eds., MRS Symp. Proc., MRS, Pittsburgh, PA",230,,1992,39-45,,"F.-Y. Shiau, Shuang-Lin Chen, M. Loomans and Y. A. Chang",Formation and Growth of an Amorphous Phase by Solid-State Reaction Between GaAs and Co Thin Films,J. Mater. Res.,6,7,1991,1532-1541,,"Y. A. Chang, J. P. Neumann and Shuang-Lin Chen",Thermodynamic Stability of Ordered Intermetallic Compound Phases,"in Alloy Phase Stability and Design, G. M. Stocks, D. P. Pope and A. F. Giamei, eds., MRS Symp. Proc., MRS, Pittsburgh, PA",186,,1991,131-140,,"Jian-Hong Hu, Shuang-Lin Chen, Wen-Juan Cai and Kuo-Chih Chou",Application of Geometric Solution Model to Predict the Surface Tension of Ternary System,J. Univ. of Sci. and Techn. Beijing (in Chinese),,,1990,,,Kuo-Chih Chou and Shuang-Lin Chen,Calculating Activities from Phase Diagram Containing Equilibrium Between Solid and Liquid Solutions,CALPHAD,14,1,1990,41-48,,Shuang-Lin Chen and Kuo-Chih Chou,The Relationship Among the Standard Free Energies of Formation of Nonadjacent Compounds for a Binary System,J. Univ. of Sci. and Techn. Beijing (in Chinese),11,4,1989,376-381,,"Shuang-Lin Chen, Jian-Qi Cui, Ting-Kun Chen and Kuo-Chih Chou",Integration Model Predicting Ternary Thermodynamic Properties From Binary Ones,CALPHAD,13,3,1989,225-230,,Shuang-Lin Chen and Kuo-Chih Chou,The Application of Rational Function to Predict Ternary Thermodynamic Properties,CALPHAD,13,1,1989,79-82,,Shuang-Lin Chen and Kuo-Chih Chou,A General Representation of Geometrical Solution Model for Predicting Ternary Thermodynamic Properties,Rare Metals,8,4,1989,22-26,,Shuang-Lin Chen and Kuo-Chih Chou,The Quasi-Parabolic Regulation of the Standard Free Energies of Formation of Binary Intermediate Compounds,Rare Metals,8,2,1989,1-4,,Shuang-Lin Chen and Kuo-Chih Chou,The Progressive Increase Regulation of Oxygen Potential on a Binary System and Its Application,Acta Metallurgica Sinica (in Chinese),24,Suppl. I,1988,B55-57,,Shuang-Lin Chen and Kuo-Chih Chou,A Progressive Increase Regulation of Oxygen Potential in a Ternary System,Acta Metallurgica Sinica (in Chinese),24,Suppl. I,1988,B58-62,,"Shuang-Lin Chen, Zhan-Zhong Hao, Fu-Shen Li and Kuo-Chih Chou",Determination of the Standard Free Energy of Formation of LaCrO3 at 1273K,J. Chinese Rare Earth Society (in Chinese),24,Suppl. I,1987,19-24,,Kuo-Chih Chou and Shuang-Lin Chen,Electrochemical Determination of Thermodynamic Properties of Intermediate Compound in Mo-O System,Solid State Ionic,18 & 19,Suppl. I,1986,907-911,,